name,in5_profile_link,website,industry,profile_description
Cameo Communications FZ-LLC,http://www.cameocomms.me,http://www.cameocomms.me,Marketing,"Cameo is an integrated agency that aims to bring back the element of surprise, one story at a time. Just like a movie cameo that comes in when you least expect it and leaves you in awe, we aim to do the same with creative solutions that inspire, delight and transform."
Capti AI FZ-LLC,https://subtitles.plus,https://subtitles.plus,Content,Capti AI automates subtitles for video content.
Cerebrion Health Innovations FZ-LLC,https://www.drbrain.asia,https://www.drbrain.asia,HealthTech,AI-powered solution for early detection and intervention of cognitive impairment
Chizl Technology Solutions FZ-LLC,http://www.chizl.ai,http://www.chizl.ai,Business IT Solution,Chizl is a SaaS platform that uses NLP and machine learning models to streamline the process of gathering industry market information and summarize critical sections of public company filings.
ComplyHawk AI FZ-LLC,https://complyhawk.ai/,https://complyhawk.ai/,Business IT Solution,"ComplyHawk automates the compliance journey from start to audit-ready with key frameworks of ISO 27001, PCI DSS, NCA ECC, UAE IA, SAMA, NIST, and more."
Comfi FZ-LLC,https://comfi.app,https://comfi.app,FinTech,"Comfi is an embedded BNPL solution that helps B2B SaaS companies to sell 2x more annual subscriptions by letting their customers pay in zero-interest installments, while vendors are paid upfront. Comfi helps to increase the cash flow of a SaaS company and save up to 30% of SaaS costs for end customers."
