name,in5_profile_link,website,industry,profile_description
Uniphi Digital Technologies FZ-LLC,https://xfin.digital,https://xfin.digital,FinTech,"Uniphi/XFIN helps small banks/NBFCs/MFIs  build their own neobank with our digital banking platform as a service. With their own neobank, their customers can download an app, do the self KYC, operate account, invest, send/receive money and perform a variety of other functions without ever having to go to a branch."
Unipreneur FZ-LLC,http://unipreneur.co/,http://unipreneur.co/,EdTech,"Unipreneur Inc is a youth entrepreneurship, leadership, and career development platform that is based on the triple helix model of innovation."
Unleash Resilience FZ-LLC,https://dubaiminds.wixsite.com/dubai-minds,https://dubaiminds.wixsite.com/dubai-minds,HealthTech,DubaiMind tackle theincreasing amount of anxiety and depression in our society.
Unlimits FZ-LLC,http://www.unlimits.ai,http://www.unlimits.ai,EdTech,"Unlimits is a revolutionary personal development platform designed to empower individuals to dream, manifest, and achieve their life goals."
uno.dos.trends FZ-LLC,https://unodostrends.com/,https://unodostrends.com/,Content,Our social commerce platform helps eCom brands and platforms create and distribute UGC content at scale. We provide three main services: 1. UGC Content Production at scale 2. Video content creation education 3. Shoppable videos feed widget (no code)
