name,in5_profile_link,industry,profile_description
5Ds Advertising FZ-LLC,https://5ds.ae,Marketing,"5Ds Advertising is a pioneering marketing company distinguished for its innovative approaches to product promotion, including cutting-edge use of Hologram technology. Our primary focus lies in Point of Sale Marketing (POS), strategically leveraging our expansive network of over 100 stores to ensure optimal brand visibility in key locations."
6bees FZ-LLC,http://www.6bees.co,Business IT Solution,"6bees is a strategy and performance ecosystem that streamlines all function\\\'s activities towards one vision, streamlining all efforts and creating a culture of teamwork and high performance."
8Zone FZ-LLC,http://www.wedomedia.tv,Gaming,"8ZONE is an eSport integration company for eSports league, tournaments, and education."
Abcurr FZ-LLC,https://www.abcurr.com/,EdTech,Digital Marketplace matching universities worldwide based on their learning objectives to facilitate the organisation of educational study trips between universities hosts & visitors we aspire to be the universities airbnb.
Able Ventures FZ-LLC,https://www.ableventures.co/,Wellness,Able is building anall-in-one platform for adults aged 50+ to take control of their condition and enable vibrant aging.
Acadlinks Technologies FZ-LLC,https://www.acadlinks.co/,EdTech,Acadlinks is a platform that connects Academia and the industry by receiving projects from companies and distributing them to students.
Wahat Games FZ-LLC,https://www.wahatgames.com/,Gaming,Wahat creates MENA culturally rich games with competitive gameplay and hosting annual esports tournaments.
Waj Technology FZ-LLC,https://www.waj.ai,Marketplace,"WAJ empowers beauty providers streamline their operations, reach more customers and deliver efficient procurement."
Walls Nation FZ-LLC,https://wallsnation.com,Interior Design,"Walls Nation is a furniture & home decor marketplace that works with many home & office specialty brands, workshops and factories, creating bespoke designs & fulfilling loose furnishing and decor needs for retailers, hotels, villas, mansions,offices & much more.  Products listed on Walls Nation range in availability from on-demand and ready-made, all products on our platforms are crafted by niche quality-tested local partners, specialized for years in the category of each product sold."
We Are Tech FZ-LLC,http://wat.ae/,Sustainability,"WAT (WE ARE TECH), is the Electronics ReCommerce platform empowering the circular economy by incentivizing individuals and businesses to buy and sell pre-owned or new virtuous items. WAT’s mission is to educate users to actively reduce waste and promote sustainability. Using WAT, users positively impact the environment and benefit from rewards based on their virtuous behavior in the circular economy."
We Placed FZ-LLC,https://we-placed.com/,Human Resource,Weplaced is an AI technology-based marketplace dedicated to blue collar and generic staffing requirements.
Whispers of Alara FZ-LLC,https://www.whispersofalara.com,Jewelry,"Alara is a boutique jewelry brand founded in 2024, dedicated to creating stunning, minimal, modern design jewelry that is inspired by MENA cultural architecural heritage. Our product range includes rings, bracelets, necklaces, and earrings, crafted from high-quality materials such as gold, diamonds, and precious stones like emeralds, rubies, and sapphires."
Wittify.AI Technologies FZ-LLC,https://wittify.ai,Business AI Solution,"Wittify.ai enables businesses to deploy AI-powered voice, chat, and omnichannel assistants that support more than 25 Arabic dialects. Its no-code platform integrates with websites, social media, CRMs, and call centres, offering plug-and-play AI with native speech tech."
WokStudio FZ-LLC,http://voquestars.ru,Music,"WorkStudio is music studio, label and a distribution platform to make relationship with artists automized and give instrument to share their royalties with team."
Writefully FZ-LLC,https://askinput.com/,Business IT Solution,"Writfully is a voice-input app to allow writers, marketers and thought leaders to get a feedback and create better content, faster."
