name,in5_profile_link,industry,profile_description
5Ds Advertising FZ-LLC,https://5ds.ae,Marketing,"5Ds Advertising is a pioneering marketing company distinguished for its innovative approaches to product promotion, including cutting-edge use of Hologram technology. Our primary focus lies in Point of Sale Marketing (POS), strategically leveraging our expansive network of over 100 stores to ensure optimal brand visibility in key locations."
6bees FZ-LLC,http://www.6bees.co,Business IT Solution,"6bees is a strategy and performance ecosystem that streamlines all function\\\'s activities towards one vision, streamlining all efforts and creating a culture of teamwork and high performance."
8Zone FZ-LLC,http://www.wedomedia.tv,Gaming,"8ZONE is an eSport integration company for eSports league, tournaments, and education."
Abcurr FZ-LLC,https://www.abcurr.com/,EdTech,Digital Marketplace matching universities worldwide based on their learning objectives to facilitate the organisation of educational study trips between universities hosts & visitors we aspire to be the universities airbnb.
Able Ventures FZ-LLC,https://www.ableventures.co/,Wellness,Able is building anall-in-one platform for adults aged 50+ to take control of their condition and enable vibrant aging.
Acadlinks Technologies FZ-LLC,https://www.acadlinks.co/,EdTech,Acadlinks is a platform that connects Academia and the industry by receiving projects from companies and distributing them to students.
Cameo Communications FZ-LLC,http://www.cameocomms.me,Marketing,"Cameo is an integrated agency that aims to bring back the element of surprise, one story at a time. Just like a movie cameo that comes in when you least expect it and leaves you in awe, we aim to do the same with creative solutions that inspire, delight and transform."
Capio Pro FZ LLC,https://capio.pro/,Business AI Solution,AI-Powered Marketing and Sales Automation and Compliance Platform.
Capti AI FZ-LLC,https://subtitles.plus,Content,Capti AI automates subtitles for video content.
Cerebrion Health Innovations FZ-LLC,https://www.drbrain.asia,HealthTech,AI-powered solution for early detection and intervention of cognitive impairment
Chizl Technology Solutions FZ-LLC,http://www.chizl.ai,Business IT Solution,Chizl is a SaaS platform that uses NLP and machine learning models to streamline the process of gathering industry market information and summarize critical sections of public company filings.
Circle Platforms FZ-LLC,https://circle-app.squarespace.com/,Entertainment,Hospitality & Entertainment Platform
Comfi FZ-LLC,https://comfi.app,FinTech,"Comfi is an embedded BNPL solution that helps B2B SaaS companies to sell 2x more annual subscriptions by letting their customers pay in zero-interest installments, while vendors are paid upfront. Comfi helps to increase the cash flow of a SaaS company and save up to 30% of SaaS costs for end customers."
ComplyHawk AI FZ-LLC,https://complyhawk.ai/,Business IT Solution,"ComplyHawk automates the compliance journey from start to audit-ready with key frameworks of ISO 27001, PCI DSS, NCA ECC, UAE IA, SAMA, NIST, and more."
Constellation Ideas FZ-LLC,https://www.constellationstocks.com/,Marketplace,Constellation Stocks is an equity research platform providing standardized reports on any traded company.
Coralytics FZ-LLC,https://coralytics.com/,Real Estate,"Coralytics is the ultimate AI powered marketing platform made for real estate Coralytics is pioneering the use of Artificial Intelligence in real estate, Over 80 AI capabilities to streamline operations, enhance listings, and attract more buyers, tenants and sellers. Coralytics empowers Marketplaces, Real Estate Agencies, Real Estate Developers and Interior Designers. As a key member of Dubai PropTec."
Cosmik Labs FZ-LLC,https://linktr.ee/belowthefoldpodcast,Content,Cosmic Labs under the brand name Below The Fold Podcast is related to advertising and marketing enabling regional and global ad tech brands and content creators looking to monetize to engage with the advertising industry in MENA
Cravin Technologies FZ-LLC,https://www.cravinchatbot.com,Business IT Solution,"Cravin is an AI based booking and ordering chatbot solution for F&B, Events, HealthCare industries."
